{
  "proveedor": "Proveedor Especializado de NLP Conversacional (Plataforma Chatbot)",
  "casoUso": "Sistema Automatizado de Registro de Objeciones de Comparendos (CNSCC)",
  "nivelRiesgo": "limitado",
  "checklistAplicado": "estandar",
  "puntuaciones": {
    "1.1": 2,
    "1.2": 2,
    "1.3": 2,
    "1.4": 2,
    "2.1": 2,
    "2.2": 2,
    "2.3": 2,
    "3.1": 2,
    "3.2": 2,
    "3.3": 2,
    "3.4": 2,
    "4.1": 2,
    "4.2": 2,
    "4.3": 2,
    "5.1": 2,
    "5.2": 2,
    "6.1": 2,
    "6.2": 2,
    "6.3": 1
  },
  "evidencias": {
    "1.1": "Certificación de reconocimiento como 'Encargado del Tratamiento' y alineación total con Ley 1581 de 2012 y Circular 002 SIC.",
    "1.2": "Adhesión contractual a los principios éticos del Framework de Gobernanza de IA del Distrito.",
    "1.3": "El proveedor cuenta con procesos estandarizados de gestión de tecnología alineados con ISO.",
    "1.4": "Participación activa en la Fase 2 (Clasificación de Riesgo) y Fase 3 (ARA/DPIA) del proyecto.",
    "2.1": "Entrega de Model Card detallada con limitaciones conocidas y métricas de desempeño.",
    "2.2": "Entrega de Data Sheet del corpus de pre-entrenamiento base.",
    "2.3": "Acceso a documentación sobre manejo de ambigüedades y casos límite.",
    "3.1": "Contrato define al Distrito como 'Responsable' y dueño de los datos.",
    "3.2": "Data Processing Agreement (DPA) firmado y validado por el DPO, incluyendo instrucciones de manejo de datos.",
    "3.3": "Mecanismos para garantizar derechos de Habeas Data integrados en el flujo de soporte.",
    "3.4": "Configuración de eliminación automática (Secure Wipe) de conversaciones a los 90 días.",
    "4.1": "Certificación ISO 27001 vigente y auditoría SOC 2 Tipo II presentada.",
    "4.2": "Superó pruebas de robustez contra ataques adversarios (prompt injection) y manejo de errores ortográficos.",
    "4.3": "Protocolo de respuesta a incidentes activado (verificado en Fase 7 - Monitoreo).",
    "5.1": "Cláusula de 'Derecho a Auditoría' aceptada contractualmante sin alegar secreto comercial.",
    "5.2": "Logs de conversaciones y métricas de desempeño accesibles para inspección.",
    "6.1": "SLA definido: Uptime > 99.5% y Precisión > 90% con penalizaciones por incumplimiento.",
    "6.2": "Soporte técnico habilitado y transferencia de conocimiento a funcionarios (capacitación).",
    "6.3": "Roadmap de actualizaciones comunicado (parcialmente documentado en contrato)."
  },
  "criteriosMandatorios": [
    {
      "id": "1.1",
      "cumplido": true
    },
    {
      "id": "3.2",
      "cumplido": true
    },
    {
      "id": "4.1",
      "cumplido": true
    },
    {
      "id": "6.1",
      "cumplido": true
    }
  ],
  "resultadoMandatorios": "cumple",
  "dictamenFinal": "recomendado",
  "observaciones": "El proveedor cumple con todos los criterios mandatorios y alcanza una puntuación de excelencia. Se destaca la transparencia técnica (entrega de Model Cards) y la robustez del DPA para cumplimiento de la Ley 1581. Aprobado para Fase de Contratación.",
  "evaluadores": {
    "responsableTecnico": "Líder de Desarrollo e Innovación",
    "fechaTecnico": "2025-11-20",
    "dpoJuridica": "Oficial de Protección de Datos (DPO)",
    "fechaDpo": "2025-11-22",
    "comiteIa": "Comité de IA (Gate 5)",
    "fechaComite": "2025-11-24"
  },
  "fechaExportacion": "2025-12-08T23:58:00-05:00",
  "versionChecklist": "2.0"
}